id,name,arcana,suit,number,element,astrology,yes_no,keywords_upright,keywords_reversed,meaning_upright,meaning_reversed,love,career,mood,spiritual
0,The Fool,major,,0,Air,Uranus,maybe,new beginnings; spontaneity; innocence; leap of faith; free spirit,recklessness; hesitation; naivety; poor judgment; fear of change,"The Fool signals a fresh start taken with an open heart, stepping into the unknown with trust rather than a detailed plan. It points to spontaneity, beginner's mind, and the willingness to risk looking foolish in order to grow.","Reversed, The Fool suggests either a reckless leap taken without thought or a journey postponed out of fear. It points to hesitation, naivety about real risks, or holding back from a beginning that is ready to happen.","In love, The Fool suggests a fresh romantic chapter, playful energy, and following the heart without guarantees.","In career, it points to a new venture, role, or idea that rewards courage and an open mind over rigid planning.","The mood is light, curious, and playful — an openness that welcomes surprises rather than bracing against them.","Spiritually, The Fool invites beginner's mind: trusting the journey before the map exists and treating the unknown as sacred ground."
1,The Magician,major,,1,Air,Mercury,yes,manifestation; willpower; resourcefulness; skill; focused action,manipulation; untapped talent; scattered energy; trickery; illusion,"The Magician shows that every tool needed is already on the table; it is a card of manifestation through focused will and skill. It suggests aligning intention, words, and action to turn an idea into reality.","Reversed, The Magician warns of scattered focus, wasted talent, or someone using charm and cleverness to manipulate. It can point to promises that sound impressive but lack substance.","In love, The Magician suggests attraction built on confidence and communication, and the power to actively create the relationship you want.","In career, it signals skill meeting opportunity — a strong moment to pitch, launch, or negotiate.",The mood is confident and energized — a focused spark that makes things feel possible right now.,"Spiritually, The Magician is about alignment: bringing thought, word, and action into one channel so intention becomes creation."
2,The High Priestess,major,,2,Water,Moon,maybe,intuition; inner wisdom; mystery; the subconscious; stillness,ignored intuition; secrets; disconnection from self; hidden agendas; surface knowledge,"The High Priestess asks for stillness and listening; the answer is already known at an intuitive level even if it cannot yet be explained. She represents hidden knowledge, the subconscious, and truths that reveal themselves in their own time.","Reversed, she suggests intuition being drowned out by noise, other people's opinions, or a refusal to look inward. Secrets may be at play, or an inner knowing is being ignored because it is inconvenient.","In love, The High Priestess points to unspoken feelings and undercurrents — trust what is sensed rather than only what is said.","In career, it advises watching and listening before acting; information is still hidden and patience reveals it.","The mood is quiet, inward, and softly mysterious — a day for listening more than speaking.","Spiritually, she points to the inner voice: intuition, dreams, and knowledge that arrives in stillness rather than study."
3,The Empress,major,,3,Earth,Venus,yes,abundance; nurturing; fertility; creativity; sensuality,creative block; smothering; self-neglect; dependence; stagnation,"The Empress embodies abundance, nurture, and creative fertility — things growing because they are cared for. She encourages receiving pleasure, tending relationships and projects patiently, and trusting natural growth.","Reversed, The Empress points to creative block, self-neglect, or care that has tipped into smothering or dependence. Growth stalls because the ground itself — body, home, heart — is being ignored.","In love, The Empress is one of the warmest cards, indicating deepening affection, nurturing partnership, and sensual connection.","In career, it favors creative projects and steady cultivation — what is tended now will bear fruit.","The mood is warm, sensual, and content — comfort in the body and pleasure in simple things.","Spiritually, The Empress teaches abundance: creation flows through care, and tending something gently is itself a devotion."
4,The Emperor,major,,4,Fire,Aries,yes,structure; authority; stability; leadership; discipline,rigidity; control issues; domination; lack of discipline; abuse of power,"The Emperor stands for structure, boundaries, and earned authority — building something stable through discipline and clear rules. He suggests taking charge, acting decisively, and protecting what has been built.","Reversed, The Emperor warns of control hardening into rigidity or domination, or conversely a lack of structure that lets things drift. Power struggles and inflexibility may be blocking progress.","In love, The Emperor points to a stabilizing, protective presence, though it cautions against controlling behavior replacing warmth.","In career, it signals leadership, order, and long-term building — take responsibility and set the framework.","The mood is steady, resolute, and composed — feet planted, emotions in order.","Spiritually, The Emperor frames discipline as devotion: structure and healthy boundaries as ways of honoring what matters."
5,The Hierophant,major,,5,Earth,Taurus,maybe,tradition; guidance; shared values; institutions; mentorship,rebellion; questioning convention; restriction; dogma; breaking rules,"The Hierophant represents tradition, teachers, and the wisdom of established paths — learning from those who walked the road before. It suggests seeking guidance, honoring commitments, and finding meaning in shared values or ritual.","Reversed, The Hierophant points to chafing against convention — rules, institutions, or expectations that no longer fit. It can signal the need to think for oneself, or a warning against dogma on either side.","In love, The Hierophant often relates to commitment and shared values, sometimes literally marriage or formalizing a bond.","In career, it favors established institutions, mentorship, and proven methods over improvisation.","The mood is reflective and respectful — drawn toward counsel, study, or familiar ritual.","Spiritually, The Hierophant honors lineage: wisdom passed down through teachers, tradition, and shared practice."
6,The Lovers,major,,6,Air,Gemini,yes,love; union; alignment; meaningful choice; harmony,disharmony; misalignment; avoidance of choice; temptation; imbalance,"The Lovers speaks of deep connection and alignment of hearts and values, and also of a significant choice made consciously. It asks that the decision reflect who you truly are, not merely what is convenient.","Reversed, The Lovers points to disharmony, mismatched values, or a choice being avoided. Something is out of alignment between what is felt, what is said, and what is done.","In love, this is the card of genuine union, mutual attraction, and a relationship built on real compatibility.","In career, it points to a values-based crossroads or a partnership that must be chosen deliberately.",The mood is tender and heart-open — connection feels close and choices feel meaningful.,"Spiritually, The Lovers is union and alignment: choosing from the soul so that love and values point the same way."
7,The Chariot,major,,7,Water,Cancer,yes,determination; victory; willpower; self-control; momentum,lack of direction; aggression; obstacles; scattered forces; loss of control,"The Chariot is a card of victory through will — holding opposing forces together and driving them in one chosen direction. It signals momentum, discipline, and success for those who keep their hands firmly on the reins.","Reversed, The Chariot suggests energy pulling in conflicting directions, forcing an outcome, or momentum stalling. The path forward needs steering, not more speed.","In love, The Chariot suggests pursuing the relationship with intention and overcoming distance or obstacles together.","In career, it signals ambition rewarded — drive, focus, and control carry a project across the line.",The mood is driven and determined — momentum with hands firmly on the reins.,"Spiritually, The Chariot is mastery of opposites: holding conflicting forces together and steering them by will toward one aim."
8,Strength,major,,8,Fire,Leo,yes,courage; inner strength; patience; compassion; gentle power,self-doubt; raw emotion; impatience; insecurity; forcing,"Strength shows power expressed as patience and compassion — taming the lion with a steady hand rather than a whip. It points to quiet courage, resilience, and mastering impulses instead of being ruled by them.","Reversed, Strength reveals self-doubt, depleted courage, or emotions running the show. It asks for self-compassion first; the inner lion is frightened, not gone.","In love, Strength speaks of patience, emotional honesty, and a bond that grows through gentleness rather than pressure.","In career, it favors persistence and calm confidence over aggressive tactics — influence beats force.","The mood is calm courage — soft on the outside, unshakeable underneath.","Spiritually, Strength teaches that gentleness is power: the inner beast is tamed by compassion, not force."
9,The Hermit,major,,9,Earth,Virgo,maybe,introspection; solitude; inner guidance; wisdom; searching,isolation; loneliness; withdrawal; lost direction; avoidance,"The Hermit withdraws from noise to find the answer by his own lamp — a card of introspection, soul-searching, and hard-won wisdom. It suggests the next step becomes clear in solitude, not in the crowd.","Reversed, The Hermit warns that healthy solitude has slipped into isolation, or that reflection is being used to avoid life. It can also mean refusing guidance that is genuinely needed.","In love, The Hermit often signals a period of reflection about what one truly needs, or a partner who requires space.","In career, it favors research, deep work, and stepping back to reassess the path before advancing.",The mood is solitary and contemplative — a pull toward quiet and one's own company.,"Spiritually, The Hermit is the inner lamp: withdrawing from noise so the soul's own light can show the next step."
10,Wheel of Fortune,major,,10,Fire,Jupiter,maybe,change; cycles; destiny; turning point; luck,resistance to change; bad luck; repeating cycles; setbacks; clinging,"The Wheel of Fortune marks a turning point: circumstances are shifting, often through forces beyond personal control. It counsels riding the change with flexibility, since what rises and falls is part of a larger cycle.","Reversed, the Wheel points to resisting a change that is happening anyway, or a cycle repeating because its lesson has not been learned. Delays and reversals ease once the pattern is acknowledged.","In love, the Wheel signals a destined shift — chance meetings, changing dynamics, or a relationship entering a new phase.","In career, it points to changing circumstances and timely opportunities; stay adaptable and catch the upswing.",The mood is anticipatory and changeable — the sense that something is turning.,"Spiritually, the Wheel teaches cycles: seasons rise and fall by design, and trust means moving with the turn rather than against it."
11,Justice,major,,11,Air,Libra,maybe,fairness; truth; accountability; cause and effect; clarity,unfairness; dishonesty; avoiding accountability; bias; imbalance,"Justice deals in truth, fairness, and consequence: decisions and actions are being weighed, and outcomes will match what was earned. It calls for honesty, balanced judgment, and taking responsibility for one's part.","Reversed, Justice points to unfairness, self-deception, or dodging accountability. Something is out of balance, and restoring it requires facing an uncomfortable truth.","In love, Justice asks for honesty and equal give-and-take; imbalances in effort or truth come due.","In career, it relates to contracts, negotiations, and fair dealing — integrity now determines the outcome.","The mood is sober and clear-eyed — weighing things honestly, including oneself.","Spiritually, Justice is karma and truth: actions ripple back, and integrity is its own form of alignment."
12,The Hanged Man,major,,12,Water,Neptune,maybe,surrender; new perspective; pause; letting go; suspension,stalling; resistance; martyrdom; indecision; wasted sacrifice,"The Hanged Man asks for willing pause and a change of perspective — progress right now comes from surrender, not pushing. Seen upside down, the problem often reveals a solution effort could never force.","Reversed, The Hanged Man shows a pause that has become stalling, or sacrifice without purpose. It suggests resisting a needed letting-go, or playing the martyr instead of making a decision.","In love, The Hanged Man counsels patience and seeing the other person's viewpoint before acting.","In career, it suggests putting a plan on hold and re-examining assumptions — the delay itself is informative.",The mood is suspended and strangely peaceful — waiting that asks not to be rushed.,"Spiritually, The Hanged Man is surrender: releasing control long enough for a completely new perspective to arrive."
13,Death,major,,13,Water,Scorpio,no,endings; transformation; transition; release; renewal,resistance to endings; stagnation; fear of change; holding on; incomplete closure,Death marks a definitive ending that clears space for transformation — a chapter closing so a truer one can begin. It rarely concerns literal death; it is the card of necessary release and renewal.,"Reversed, Death shows an ending being resisted: clinging to what is already over and prolonging the discomfort of transition. Stagnation persists until the release is allowed.","In love, Death signals the end of a dynamic or relationship phase, making room for a more honest connection.","In career, it points to closing a role, project, or identity — transformation follows the letting-go.",The mood is heavy yet quietly relieved — the weight of an ending already loosening its grip.,"Spiritually, Death is transformation: every rebirth begins with a release, and what falls away makes room for what is truly next."
14,Temperance,major,,14,Fire,Sagittarius,yes,balance; moderation; patience; blending; healing,excess; imbalance; impatience; friction; overcorrection,"Temperance blends opposites into harmony — a card of moderation, patience, and finding the middle path. It suggests healing through steady adjustment rather than dramatic moves.","Reversed, Temperance reveals excess or imbalance: too much of one thing, too little of another, and friction as a result. It calls for recalibration before the imbalance causes real damage.","In love, Temperance indicates growing harmony, patience with differences, and a relationship finding its natural rhythm.","In career, it favors steady progress, collaboration, and balancing competing demands without burning out.","The mood is serene and even — nothing extreme, everything gently blended.","Spiritually, Temperance is alchemy: mixing opposites with patience until they become something finer than either alone."
15,The Devil,major,,15,Earth,Capricorn,no,attachment; temptation; unhealthy patterns; materialism; feeling trapped,breaking free; reclaiming power; awareness; release; recovery,"The Devil exposes chains that are worn voluntarily — addictions, obsessions, toxic dynamics, or fears that keep one bound. It asks an honest look at what feels impossible to leave but is actually a choice.","Reversed, The Devil is the moment of breaking free: seeing the pattern clearly and reclaiming power from it. Old attachments loosen once they are named.","In love, The Devil can indicate intense attraction shadowed by possessiveness, dependency, or patterns that diminish both people.","In career, it warns of golden handcuffs, burnout loops, or compromising values for material security.","The mood is tense and restless — tempted, tethered, or circling an old habit.","Spiritually, The Devil calls for shadow work: facing the attachments that bind and remembering the chains are loose."
16,The Tower,major,,16,Fire,Mars,no,sudden upheaval; revelation; collapse of the false; disruption; awakening,averted disaster; fear of change; delayed collapse; resisting the inevitable; internal upheaval,"The Tower is sudden upheaval that demolishes what was built on shaky ground — shocking, but ultimately clarifying. What falls was not stable; the lightning also illuminates.","Reversed, The Tower suggests upheaval resisted, delayed, or happening internally — a quiet crisis of belief rather than an outer collapse. Propping up the unstable only postpones the rebuild.","In love, The Tower points to a sudden revelation or shake-up that changes the relationship's foundation and demands honesty.","In career, it signals abrupt disruption — restructures, failures, or truths surfacing — that clears the way for something sounder.",The mood is shaken and electric — the ground moving underfoot.,"Spiritually, The Tower is awakening by lightning: false structures fall so that truth has somewhere to stand."
17,The Star,major,,17,Air,Aquarius,yes,hope; renewal; healing; inspiration; faith,discouragement; lost faith; disconnection; self-doubt; dimmed hope,"The Star is the calm after the storm — hope, healing, and quiet faith that the path ahead is good. It encourages openness, authenticity, and trusting that renewal is already underway.","Reversed, The Star shows hope running low and inspiration feeling out of reach. The light has not gone out; reconnecting to what genuinely nourishes will reveal it again.","In love, The Star brings healing after difficulty and renewed faith in connection — a gentle, promising sign.","In career, it signals renewed purpose and long-term promise; keep faith in the direction even if progress is quiet.",The mood is hopeful and soothed — a quiet exhale after a long storm.,"Spiritually, The Star is grace: healing, renewal, and the faith that the universe is gently guiding, not testing."
18,The Moon,major,,18,Water,Pisces,maybe,illusion; intuition; uncertainty; the subconscious; dreams,clarity emerging; released fear; truth surfacing; confusion lifting; self-deception ending,"The Moon casts a landscape of shadows where fear and imagination distort what is real — things are not as they appear. It counsels moving slowly, trusting intuition over anxiety, and waiting for daylight before final judgments.","Reversed, The Moon marks confusion beginning to lift: secrets surface, fears shrink to their true size, and the road becomes visible again. Clarity is returning after a disorienting stretch.","In love, The Moon points to uncertainty, mixed signals, or projections — feelings are real but the picture is incomplete.","In career, it warns of unclear information or hidden factors; verify facts before committing.","The mood is dreamy and uneasy — feelings vivid, facts blurry.","Spiritually, The Moon is the subconscious speaking: dreams, symbols, and intuition lighting a path the rational mind cannot."
19,The Sun,major,,19,Fire,Sun,yes,joy; success; vitality; clarity; confidence,dimmed joy; temporary setbacks; pessimism; burnout; delayed success,"The Sun is the deck's most unambiguously positive card: warmth, vitality, success, and truth in full daylight. It signals things genuinely going well and invites wholehearted enjoyment of it.","Reversed, The Sun does not turn dark — it dims: joy muted by pessimism, fatigue, or clouds of doubt over real success. The good is still there; perspective needs cleaning, not the circumstances.","In love, The Sun radiates happiness, openness, and celebration — a relationship thriving in honest light.","In career, it signals visible success, recognition, and energy — momentum is real and deserved.","The mood is joyful and radiant — warmth, play, and easy confidence.","Spiritually, The Sun is vitality and gratitude: clarity so bright that simply being alive feels like the blessing it is."
20,Judgement,major,,20,Fire,Pluto,yes,awakening; reckoning; renewal; calling; self-evaluation,self-criticism; ignoring the call; stuck in the past; harsh judgment; avoidance,Judgement is the wake-up call: an honest reckoning with the past that frees one to rise into a new phase. It often marks a moment of clarity about purpose — a summons that should be answered.,"Reversed, Judgement shows the call being ignored, or self-judgment so harsh it prevents moving forward. The past is reviewed on a loop instead of being released.","In love, Judgement brings honest evaluation of the relationship's history and a chance at genuine renewal or closure.","In career, it signals a career reckoning or calling — an invitation to step into work that actually matters to you.",The mood is stirred and resolved — an honest reckoning that ends in relief.,"Spiritually, Judgement is the awakening call: rising from the past, forgiven and lighter, toward a truer purpose."
21,The World,major,,21,Earth,Saturn,yes,completion; fulfillment; wholeness; achievement; integration,incompletion; loose ends; delayed closure; shortcuts; unfinished business,"The World is completion: a long cycle fulfilled, lessons integrated, and a well-earned sense of wholeness. It celebrates achievement and signals readiness for the next, larger cycle.","Reversed, The World points to a goal almost reached but not closed — loose ends, missing steps, or closure being postponed. Finish the last mile; the reward waits there.","In love, The World signifies a relationship reaching fulfillment and harmony, or closure that finally allows a new beginning.","In career, it marks the successful completion of a major goal and often expansion — travel, recognition, or a bigger stage.",The mood is fulfilled and celebratory — a deep sense of arrival.,"Spiritually, The World is integration: the lessons of a whole cycle woven into wholeness before the next dance begins."
22,Ace of Wands,minor,wands,1,Fire,Root of Fire,yes,inspiration; new opportunity; creative spark; enthusiasm; potential,delays; false start; lack of motivation; blocked creativity; hesitation,"The Ace of Wands is a spark of pure creative potential — a new idea, passion, or opportunity bursting with energy. It invites saying yes and acting while the fire is hot.","Reversed, the Ace shows inspiration that stalls: false starts, delays, or enthusiasm that fizzles before it becomes action. The spark needs fuel and commitment to catch.","In love, it signals a spark of fresh attraction or renewed passion in an existing bond.","In career, it marks the ignition of a new project or venture — promising, if acted on quickly.",The mood is excited and inspired — new energy crackling to be used.,"Spiritually, the Ace of Wands is the creative spark as gift: inspiration arriving from beyond and asking to be acted on."
23,Two of Wands,minor,wands,2,Fire,Mars in Aries,maybe,planning; future vision; decision; expansion; the world in hand,fear of the unknown; playing it safe; poor planning; restlessness; indecision,"The Two of Wands is the planner's card: standing at a threshold, world in hand, weighing how far to venture. It suggests bold vision paired with deliberate first steps.","Reversed, it shows ambition trapped by fear of the unknown — staying in familiar territory while opportunity waits outside. Plans exist but the commitment to leave the castle does not.","In love, it points to weighing a decision about the relationship's future direction.","In career, it favors strategic planning and considering expansion beyond the current comfort zone.","The mood is restless anticipation — plans forming, horizons calling.","Spiritually, it expands the vision: the soul outgrowing familiar walls and daring to imagine a larger life."
24,Three of Wands,minor,wands,3,Fire,Sun in Aries,yes,progress; expansion; foresight; ships coming in; momentum,delays; obstacles to plans; limited vision; setbacks; impatience,The Three of Wands shows plans in motion and horizons expanding — the ships are launched and beginning to return. It encourages confidence in the direction while staying alert for arriving opportunities.,"Reversed, it signals delays and shipments that haven't come in: plans meeting friction or vision proving too narrow. Reassess logistics rather than abandoning the voyage.","In love, it suggests a relationship moving forward, sometimes across distance, with patience being rewarded.","In career, it marks early results confirming a good strategy — think bigger and prepare for growth.",The mood is optimistic and forward-looking — effort already sailing back as results.,"Spiritually, it teaches faithful patience: what was set in motion is growing even while it is out of sight."
25,Four of Wands,minor,wands,4,Fire,Venus in Aries,yes,celebration; homecoming; milestone; community; stability,instability at home; postponed celebration; transition; lack of support; shaky foundations,The Four of Wands is celebration and homecoming — a milestone reached and shared with the people who matter. It marks stability worth pausing to enjoy before the next stage.,"Reversed, it points to tension at home, a celebration delayed, or a sense of not quite belonging. The foundation wants attention before the party can happen.","In love, it is a card of happy milestones — moving in together, engagements, or simply a joyful, secure phase.","In career, it marks a completed stage worth celebrating and a supportive, stable team environment.","The mood is celebratory and secure — belonging, milestones, open doors.","Spiritually, it is gratitude in community: pausing to honor how far things have come, together."
