id,name,arcana,suit,number,element,astrology,yes_no,keywords_upright,keywords_reversed,meaning_upright,meaning_reversed,love,career,mood,spiritual
26,Five of Wands,minor,wands,5,Fire,Saturn in Leo,no,conflict; competition; friction; clashing egos; scattered effort,avoiding conflict; resolution; inner conflict; release of tension; picking battles,"The Five of Wands is friction: competing voices, clashing egos, and energy scattered in a scramble. The conflict is usually more noise than damage, but nothing advances until efforts align.","Reversed, it shows conflict either being dodged or finally winding down. It can also point inward — competing desires fighting inside one person.","In love, it signals bickering, rivalry, or outside interference creating unnecessary tension.","In career, it points to competition and disagreement over direction — channel it into healthy rivalry, not chaos.",The mood is irritable and competitive — energy scattering into friction.,"Spiritually, it is ego work: noticing the need to win and redirecting that fire into growth instead of noise."
27,Six of Wands,minor,wands,6,Fire,Jupiter in Leo,yes,victory; recognition; success; confidence; public acclaim,private victory; fall from grace; self-doubt; lack of recognition; ego inflation,The Six of Wands is the victory parade: success achieved and publicly recognized. It confirms that effort has paid off and confidence is warranted.,"Reversed, it suggests success unacknowledged, confidence wobbling, or acclaim that went to the head. The win may be real but the applause is missing — or hollow.","In love, it signals pride in the relationship and mutual admiration, being 'seen' by a partner.","In career, it points to recognition, promotion, or a win that raises your profile.",The mood is proud and uplifted — effort seen and cheered.,"Spiritually, it pairs success with humility: receiving recognition gracefully and honoring those who helped."
28,Seven of Wands,minor,wands,7,Fire,Mars in Leo,maybe,defense; standing your ground; perseverance; conviction; holding advantage,overwhelm; giving up ground; exhaustion; defensiveness; yielding,"The Seven of Wands is the defense of hard-won ground: challengers press from below, but the higher position holds. It calls for conviction and stamina — the position is defensible if it's defended.","Reversed, it shows defenses wearing thin: overwhelm, exhaustion, or surrendering ground that could have been held. It may also warn against defensiveness where none is needed.","In love, it can mean protecting the relationship from outside pressure, or defending personal boundaries within it.","In career, it points to defending your position, ideas, or territory against competition — persistence wins.","The mood is defensive but resolute — tested, yet standing firm.","Spiritually, it is conviction: defending what one truly believes, calmly, without needing everyone's agreement."
29,Eight of Wands,minor,wands,8,Fire,Mercury in Sagittarius,yes,swift movement; momentum; news arriving; alignment; rapid progress,delays; frustration; scattered energy; missed timing; slowdown,"The Eight of Wands is speed: events accelerating, messages arriving, and obstacles clearing all at once. It advises readiness — things long awaited now move quickly.","Reversed, it marks delays and misfires: momentum stalling, messages crossed, timing off. Rushing against the slowdown makes it worse; re-aim before re-launching.","In love, it signals fast-moving romance, important messages, or a relationship suddenly gaining momentum.","In career, it points to rapid developments, quick decisions, and news that sets things in motion.","The mood is swift and eager — messages, movement, momentum.","Spiritually, it is flow: signs arriving quickly and the invitation to move with them rather than overthink."
30,Nine of Wands,minor,wands,9,Fire,Moon in Sagittarius,maybe,resilience; last stand; persistence; guardedness; nearly there,burnout; paranoia; giving up at the end; rigid defenses; battle fatigue,"The Nine of Wands is the wounded sentry still standing: battered by past battles but not beaten, with the finish line close. It counsels one more push — resilience now completes what persistence started.","Reversed, it shows defenses built from old wounds doing more harm than protection, or collapse just short of the goal. Rest and reinforcement, not surrender, are what's needed.","In love, it points to guardedness from past hurt — the walls that protected once may now be keeping love out.","In career, it signals fatigue near the end of a long effort; endurance through this last stretch pays off.","The mood is weary but determined — bruised, guarded, unbeaten.","Spiritually, it is resilience as practice: tending wounds without letting them close the heart before the last step."
31,Ten of Wands,minor,wands,10,Fire,Saturn in Sagittarius,no,burden; overload; responsibility; carrying too much; final effort,release; delegation; putting burdens down; collapse; learning to say no,"The Ten of Wands is success turned heavy: every wand carried alone, vision blocked by the load itself. The task is nearly done, but the card asks what can be delegated or dropped.","Reversed, it is the moment of setting burdens down — delegating, quitting what isn't yours to carry, or collapsing under a load ignored too long. Release is overdue.","In love, it warns of one partner shouldering the relationship's weight alone — rebalancing is needed.","In career, it signals overload and burnout risk; delegate and prioritize before the load drops you.",The mood is burdened and overloaded — carrying more than one's share.,"Spiritually, it is release: learning that putting down what was never yours to carry is also an act of faith."
32,Page of Wands,minor,wands,11,Fire,"Fire signs (Aries, Leo, Sagittarius)",yes,enthusiasm; exploration; free spirit; exciting news; curiosity,scattered energy; hasty starts; boredom; unreliable news; restlessness,"The Page of Wands is the eager explorer: curious, spontaneous, and carrying news of exciting possibilities. It encourages a playful, experimental approach to a new passion.","Reversed, the Page starts everything and finishes nothing — enthusiasm without follow-through, or news that disappoints. Direction, not more sparks, is what's missing.","In love, it brings flirtation, playful energy, or an admirer with an adventurous spirit.","In career, it signals a new idea or opportunity worth exploring with fresh eyes and low stakes.","The mood is curious and enthusiastic — sparks everywhere, ready to explore.","Spiritually, it is following inspiration: treating every spark of interest as a possible message from the soul."
33,Knight of Wands,minor,wands,12,Fire,"Fire signs (Aries, Leo, Sagittarius)",yes,action; adventure; passion; bold pursuit; charisma,impulsiveness; recklessness; scattered passion; delays in action; hot temper,"The Knight of Wands charges in with passion and flair — a card of bold, energetic pursuit of what excites. It favors decisive action, though the follow-through matters as much as the charge.","Reversed, the Knight is all gallop and no direction: impulsive moves, burned bridges, or passion that flames out. Slow the horse enough to aim it.","In love, it brings intense, fast-burning attraction or a charismatic pursuer — thrilling, but test the staying power.","In career, it signals bold moves and fast opportunities; act decisively but don't skip the details.",The mood is adventurous and impulsive — hot energy that wants to move now.,"Spiritually, it is passion as fuel: honoring the fire while learning to ground it so it warms rather than burns."
34,Queen of Wands,minor,wands,13,Fire,"Fire signs (Aries, Leo, Sagittarius)",yes,confidence; warmth; determination; magnetism; independence,insecurity; jealousy; demanding nature; burnout; dimmed confidence,"The Queen of Wands is warm, confident, and magnetic — someone who owns a room without demanding it. She encourages leading with authenticity, courage, and generous fire.","Reversed, the Queen's fire turns inward or sour: insecurity behind bravado, jealousy, or warmth depleted by overextension. Her confidence returns when she stops performing it.","In love, she signals passionate, self-assured energy — attraction rooted in independence rather than need.","In career, she embodies confident leadership and creative drive that inspires others.",The mood is confident and magnetic — warmth that fills a room.,"Spiritually, she is authentic radiance: self-expression as a form of generosity, shining without apology."
35,King of Wands,minor,wands,14,Fire,"Fire signs (Aries, Leo, Sagittarius)",yes,visionary leadership; boldness; entrepreneurship; mastery of fire; inspiration,arrogance; tyranny; impulsive leadership; unfulfilled vision; domineering,The King of Wands is the visionary leader: fire mastered and directed at long-range goals. He inspires others to build his vision and rewards boldness backed by experience.,"Reversed, the King becomes domineering or erratic — vision without patience, authority without listening. Leadership recovers when ego steps aside for the mission.","In love, he represents a confident, protective partner with big plans — generous, though he must share the wheel.","In career, he signals entrepreneurial vision and decisive leadership — think big and commit fully.","The mood is bold and visionary — leadership energy, eyes on the horizon.","Spiritually, he is purpose embodied: directing creative fire toward a vision larger than the self."
36,Ace of Cups,minor,cups,1,Water,Root of Water,yes,new love; emotional beginning; compassion; overflowing heart; spiritual opening,blocked emotions; emptiness; repressed feelings; emotional loss; self-love needed,"The Ace of Cups is the heart overflowing: new love, deep compassion, or an emotional and spiritual awakening. It invites receiving and giving feeling freely, without rationing.","Reversed, the Ace shows the cup tipped or blocked — emotions withheld, love unexpressed, or an inner emptiness asking for attention. Refilling starts with self-compassion.","In love, it is one of the strongest cards for new romance or a fresh emotional depth in an existing bond.","In career, it signals emotionally fulfilling work, creative flow, or warm new connections.","The mood is tender and open-hearted — feelings close to the surface, in the best way.","Spiritually, the Ace of Cups is love as opening: the heart offered and refilled from a source deeper than circumstance."
37,Two of Cups,minor,cups,2,Water,Venus in Cancer,yes,partnership; mutual attraction; connection; harmony; union of equals,imbalance; broken connection; tension; miscommunication; self-partnership needed,"The Two of Cups is mutual recognition: two people meeting as equals in attraction, friendship, or alliance. It marks a genuine bond where feeling flows both ways.","Reversed, it shows a connection out of balance — one cup fuller than the other, trust strained, or harmony disrupted. Repair begins with honest, equal exchange.","In love, it is the card of mutual attraction and partnership — a bond of genuine reciprocity.","In career, it favors partnerships, collaborations, and one-on-one alliances built on mutual respect.","The mood is affectionate and harmonious — met, mirrored, understood.","Spiritually, it is sacred connection: another person as a mirror in which the soul recognizes itself."
38,Three of Cups,minor,cups,3,Water,Mercury in Cancer,yes,celebration; friendship; community; joy shared; creative collaboration,overindulgence; third-party interference; isolation from friends; gossip; excess,The Three of Cups is friendship and shared joy — the toast among people who genuinely celebrate each other. It encourages leaning into community and marking wins together.,"Reversed, it warns of overindulgence, gossip, or a third presence straining a bond. It can also signal withdrawal from friends when their support is most needed.","In love, it brings celebration and social warmth, though reversed it can flag outside interference in the relationship.","In career, it signals successful teamwork and collaborative wins worth celebrating.","The mood is joyful and sociable — laughter shared, cups raised.","Spiritually, it is communion: gratitude multiplied by being celebrated among kindred spirits."
39,Four of Cups,minor,cups,4,Water,Moon in Cancer,no,apathy; contemplation; disconnection; missed offer; reevaluation,renewed interest; accepting the offer; emerging from withdrawal; new motivation; openness,"The Four of Cups is emotional weariness: arms crossed, absorbed in discontent, while a new cup is offered unseen. It asks whether the boredom is real or whether attention has simply turned away from what's available.","Reversed, it marks the end of apathy — noticing the offered cup at last and re-engaging with life. Motivation returns as attention comes back to the present.","In love, it suggests emotional distance or taking a partner for granted; an offer of connection may be going unnoticed.","In career, it signals disengagement or an overlooked opportunity — look again before saying nothing interests you.","The mood is apathetic and withdrawn — full cups nearby, appetite gone.","Spiritually, it is a call to presence: noticing the blessing being offered before deciding nothing is there."
40,Five of Cups,minor,cups,5,Water,Mars in Scorpio,no,loss; grief; regret; focusing on what's gone; disappointment,acceptance; moving on; forgiveness; seeing what remains; healing,The Five of Cups is grief fixed on the three spilled cups while two still stand full behind. The loss is real and deserves mourning — and the card gently notes that not everything is lost.,"Reversed, it marks the turn toward healing: accepting what happened, forgiving, and finally seeing the cups still standing. Recovery has begun.","In love, it points to grieving a loss or disappointment — and to the remaining connection that grief may be obscuring.","In career, it signals a setback worth mourning briefly, then salvaging — something valuable survived the spill.",The mood is sorrowful and regretful — attention fixed on what spilled.,"Spiritually, it is grief as teacher: mourning honestly, then turning to the cups that still stand."
41,Six of Cups,minor,cups,6,Water,Sun in Scorpio,yes,nostalgia; childhood; innocence; reunion; simple kindness,stuck in the past; rose-tinted memory; leaving home; growing up; releasing old ties,"The Six of Cups is sweet memory and simple kindness — nostalgia, reunions, and the healing comfort of the familiar. It can herald someone from the past returning or old joys revisited.","Reversed, it warns of living in a rose-tinted past at the present's expense. It can also mark the healthy release of old ties and childhood patterns.","In love, it evokes innocent affection, a past lover resurfacing, or reconnecting with why you fell for each other.","In career, it can signal returning to earlier passions or working with something from your past.",The mood is nostalgic and sweet — memory softening the present.,"Spiritually, it is inner-child healing: revisiting innocence to reclaim the simple kindness the soul remembers."
42,Seven of Cups,minor,cups,7,Water,Venus in Scorpio,maybe,choices; fantasy; illusion; wishful thinking; options,clarity; decision made; cutting through illusion; overwhelm ending; realism,"The Seven of Cups is a cloud of glittering options, some real and some mirage. It warns against choosing by fantasy alone — examine what each cup actually contains before reaching.","Reversed, the fog lifts: illusions dissolve, priorities sharpen, and a real choice gets made. Commitment replaces daydreaming.","In love, it cautions against idealizing someone or keeping options endlessly open instead of choosing.","In career, it signals many possibilities but a need for realistic evaluation — pick one and commit.","The mood is dreamy and indecisive — many doors, all glittering.","Spiritually, it is discernment: asking which vision feeds the soul and which merely fascinates it."
43,Eight of Cups,minor,cups,8,Water,Saturn in Pisces,no,walking away; seeking deeper meaning; leaving behind; disillusionment; quest,fear of leaving; returning; avoidance; staying too long; unfinished departure,The Eight of Cups is the quiet departure: leaving behind something built because it no longer feeds the soul. It honors the courage to seek deeper meaning even at real cost.,"Reversed, it shows the departure stalled — knowing it's time to go but staying, or drifting away without truly deciding. It can also mark a return to give things one more chance.","In love, it signals emotionally outgrowing a situation and the difficult choice to walk away or recommit fully.","In career, it points to leaving a stable but unfulfilling path in search of meaningful work.",The mood is wistful and restless — the quiet ache of outgrowing something.,"Spiritually, it is the soul's quest: leaving the comfortable shore because meaning has moved elsewhere."
44,Nine of Cups,minor,cups,9,Water,Jupiter in Pisces,yes,wishes fulfilled; contentment; satisfaction; pleasure; gratitude,superficial happiness; greed; unfulfilled wishes; smugness; inner lack,"The Nine of Cups is the wish card: satisfaction, comfort, and desires coming to fruition. It invites genuine enjoyment and gratitude for what has been achieved.","Reversed, it questions the satisfaction on display — pleasure that doesn't nourish, smugness, or wishes granted that weren't the right wishes. Fulfillment needs realigning with what actually matters.","In love, it signals emotional contentment and wishes in matters of the heart coming true.","In career, it marks well-earned satisfaction and rewards — enjoy the achievement without coasting.","The mood is content and satisfied — wishes landing, comfort earned.","Spiritually, it is gratitude's test: enjoying fulfillment while asking what truly nourishes beneath the pleasure."
45,Ten of Cups,minor,cups,10,Water,Mars in Pisces,yes,lasting happiness; family harmony; emotional fulfillment; love realized; belonging,family discord; broken harmony; unrealistic ideals; disconnection at home; strained bonds,"The Ten of Cups is the rainbow over the family: lasting emotional fulfillment, harmony at home, and love realized in daily life. It represents the happy ending that is also a way of living.","Reversed, it shows the picture and the reality diverging — tension behind the family portrait or ideals straining real relationships. Reconnection asks for honesty over performance.","In love, it is a card of deep commitment, family, and shared happiness — the full emotional arc.","In career, it signals work-life harmony and an environment that feels like belonging.",The mood is loving and fulfilled — harmony that feels like home.,"Spiritually, it is love realized: everyday life itself becoming the blessing that was once only wished for."
46,Page of Cups,minor,cups,11,Water,"Water signs (Cancer, Scorpio, Pisces)",yes,emotional openness; creative message; intuition budding; sensitivity; sweet surprise,emotional immaturity; moodiness; blocked creativity; escapism; oversensitivity,"The Page of Cups is the tender dreamer bearing an unexpected gift — a sweet message, a creative impulse, or a first stirring of feeling. It encourages openness to whimsy and intuition.","Reversed, the Page turns moody or escapist: feelings expressed sideways, creativity blocked, or sensitivity tipping into sulking. The emotions are valid; the expression needs maturing.","In love, it brings sweet gestures, budding feelings, or a sensitive admirer.","In career, it signals creative beginnings and intuitive nudges worth taking seriously.",The mood is playful and sensitive — imagination bubbling up unannounced.,"Spiritually, it is budding intuition: whimsical messages from the heart that deserve to be taken seriously."
47,Knight of Cups,minor,cups,12,Water,"Water signs (Cancer, Scorpio, Pisces)",yes,romance; charm; invitation; following the heart; idealism,unrealistic promises; moodiness; disillusionment; flattery; heart over head gone wrong,"The Knight of Cups rides in with an offer of the heart — romance, an invitation, or an ideal pursued with genuine feeling. It favors following the heart while keeping one foot on the ground.","Reversed, the Knight's charm outpaces his substance: beautiful words without follow-through, or idealism curdling into disappointment. Judge by actions, not poetry.","In love, he is the classic romantic — courtship, proposals, and grand feeling — though reversed his promises need testing.","In career, he brings creative proposals and appealing offers; verify the practical details.","The mood is romantic and idealistic — led by the heart, gladly.","Spiritually, it is the heart's calling: following feeling as a compass while keeping one foot on the earth."
48,Queen of Cups,minor,cups,13,Water,"Water signs (Cancer, Scorpio, Pisces)",yes,compassion; emotional depth; intuition; nurturing presence; empathy,emotional overwhelm; codependency; martyrdom; boundaries dissolved; manipulation through feeling,"The Queen of Cups is deep water held in a graceful vessel: profound empathy, intuition, and emotional wisdom. She listens beneath words and nurtures without drowning.","Reversed, the Queen loses her shoreline — absorbing everyone's feelings, giving past empty, or using emotion to steer others. Boundaries restore her gift.","In love, she embodies emotional attunement and devoted care — a bond where feelings are truly heard.","In career, she favors empathic leadership, counseling, and work guided by emotional intelligence.","The mood is empathic and calm — deep waters, gently held.","Spiritually, she is compassion embodied: emotional depth as a gift that heals others without drowning the self."
49,King of Cups,minor,cups,14,Water,"Water signs (Cancer, Scorpio, Pisces)",yes,emotional mastery; calm authority; diplomacy; balance of heart and head; wise counsel,repressed emotion; coldness; manipulation; moodiness in power; emotional volatility,"The King of Cups sails turbulent seas without capsizing: emotional mastery, diplomacy, and compassion held in steady balance. He advises leading with calm heart rather than reaction.","Reversed, the King's calm is a lid: repressed feelings leaking as coldness, moodiness, or quiet manipulation. Mastery means feeling fully, not feeling less.","In love, he is the emotionally steady partner — supportive and composed, provided the depths are shared, not sealed.","In career, he signals wise counsel and diplomacy — staying gracious and level under pressure.","The mood is steady and gracious — feelings present, never in charge.","Spiritually, he is mastery of the heart: wisdom that comes from feeling everything and being ruled by none of it."
50,Ace of Swords,minor,swords,1,Air,Root of Air,yes,clarity; breakthrough; truth; new idea; mental sharpness,confusion; clouded judgment; misused intellect; harsh words; false clarity,"The Ace of Swords is a breakthrough of clarity: the truth cutting cleanly through confusion, a decisive new idea, or a moment of piercing insight. It favors honest speech and clear-eyed decisions.","Reversed, the blade is dulled or misaimed — muddled thinking, arguments that wound without resolving, or a 'truth' built on faulty premises. Sharpen the facts before swinging.","In love, it calls for honest conversation — clarity about feelings and intentions, even when it's uncomfortable.","In career, it marks a breakthrough idea or decisive clarity about direction — act on the insight.",The mood is sharp and alert — the mind cutting cleanly through fog.,"Spiritually, the Ace of Swords is revelation: truth arriving like light, asking to be spoken with care."
51,Two of Swords,minor,swords,2,Air,Moon in Libra,maybe,stalemate; difficult choice; avoidance; blocked feelings; truce,decision forced; information revealed; stalemate breaking; anxiety; release of denial,"The Two of Swords is a self-imposed stalemate: blindfolded, arms crossed, refusing to look at the choice that must be made. The balance feels safe but costs energy to maintain — deciding is the relief.","Reversed, the blindfold slips: the deadlock breaks, information surfaces, or the choice is forced by events. Delayed decisions now demand attention.","In love, it points to avoidance of a hard conversation or a heart guarded behind crossed swords.","In career, it signals a decision being postponed — gather the missing facts and choose.",The mood is torn and guarded — a standstill held with effort.,"Spiritually, it is stillness before decision: closing the eyes to the noise so inner counsel can be heard."
52,Three of Swords,minor,swords,3,Air,Saturn in Libra,no,heartbreak; painful truth; grief; sorrow; separation,healing heartbreak; forgiveness; releasing pain; recovery; old wounds resurfacing,"The Three of Swords is heartbreak rendered honestly: a painful truth, betrayal, or loss that pierces cleanly. Its mercy is precision — this pain names exactly what needs healing.","Reversed, it marks the slow removal of the swords: forgiveness, healing, and pain beginning to release — though sometimes it flags an old wound reopening to finally heal properly.","In love, it signals heartbreak, hard truths, or separation — grief that must be felt before it can pass.","In career, it points to a painful disappointment or harsh feedback that, once absorbed, clarifies the path.",The mood is hurt and raw — a truth that stings.,"Spiritually, it is heartbreak as opening: pain that names exactly what needs healing, so healing can begin."
